<?xml version="1.0" encoding="UTF-8"?>
<backup xmlns="https://github.com/jnphilipp/backup/" xmlns:xsi="http://www.w3.org/2001/XMLSchema-instance" xsi:schemaLocation="https://github.com/jnphilipp/backup/ https://raw.githubusercontent.com/jnphilipp/backup/master/backup.xsd">
    <tool name="borg">--verbose --list --stats --show-rc --compression zstd,11 --exclude-caches</tool>
    <sources>
        <source><path>/boot</path></source>
        <source><path>/etc</path></source>
        <source>
            <path>/home</path>
            <exclude>*.pyc</exclude>
            <exclude>**/.cache</exclude>
            <exclude>**/venv</exclude>
            <exclude>**/.venv</exclude>
            <exclude>**/__pycache__</exclude>
            <exclude>**/.mypy_cache</exclude>
        </source>
        <source><path>/opt</path></source>
        <source><path>/root</path></source>
        <source><path>/srv</path></source>
        <source>
            <path>/var</path>
            <exclude>var/**/logs</exclude>
            <exclude>pp:var/cache</exclude>
            <exclude>pp:var/crash</exclude>
            <exclude>pp:var/log</exclude>
            <exclude>pp:var/lock</exclude>
            <exclude>pp:var/run</exclude>
            <exclude>pp:var/spool</exclude>
            <exclude>pp:var/tmp</exclude>
            <pattern>+var/cache/pacman</pattern>
        </source>
    </sources>
    <pipeline>
        <step no="1">backup</step>
    </pipeline>
</backup>
